Country,Beach / Location Name,Accommodation Name,Rating (Out of 5),Fee (USD/Night),Review Date,Written Review 
Turks and Caicos,Grace Bay Beach,Amanyara,4.9,"$1,800",11/20/2025,Impossibly white sand and water so blue it looks like a paintingabsolute Caribbean perfection!
Portugal,Praia da Falsia (Algarve),"Pine Cliffs Hotel, a Luxury Collection",4.7,$410,10/15/2025,"The dramatic golden cliffs meet the azure Atlantic in a stunning, unforgettable vista."
Mexico,Tulum Beach,Be Tulum Hotel,4.5,$650,12/01/2025,"Chic, bohemian luxury right on the white sands, perfect for a spiritual and stylish escape."
Philippines,El Nido (Palawan),Amanpulo,4.8,"$2,000",11/12/2025,None
South Africa,Boulders Beach (Cape Town),Tintswalo at Boulders Beach,4.8,$580,10/05/2025,Sharing the sand with African Penguins makes this an incredibly unique and delightful experience!
Greece,Elafonisi Beach (Crete),Elafonisi Resort by Kalomirakis Family,4.3,$150,09/28/2025,The faint pink sand and shallow turquoise lagoon are truly magical and serene.
Colombia,Tayrona National Park,Ecohabs Tequendama (Inside Park),4.2,$250,10/22/2025,"Rugged coast, jungle vibes, and hammocks for sleepingnature's luxury at its finest!"
Australia,Hyams Beach (NSW),The Hyams Beach Seaside Cottages,4.6,$320,12/08/2025,None
New Zealand,Koekohe Beach,Moeraki Village Holiday Park,4.1,$95,11/03/2025,"Fascinatingly round Moeraki Boulders scattered on the beach create an alien, beautiful landscape."
Iceland,Djpalnssandur Beach,Hotel Hellnar,4.0,$210,11/26/2025,Eerie and fascinating black pebble beach with iron remnants of a shipwreck and incredible rock formations.  ship
Albania,Jale Beach,Folie Marine Luxury Hotel & Resort,4.4,$185,11/14/2025,A stunning hidden bay on the Albanian Riviera with clear Ionian water and vibrant nightlife.
Italy,Spiaggia dei Conigli (Lampedusa),Hotel Falco Azzurro,4.5,$180,09/08/2025,Crystal-clear water for swimming and a tranquil atmosphere perfect for escaping the crowds.
Madagascar,Nosy Iranja,Princesse Bora Lodge & Spa,4.6,$420,11/23/2025,"The sandbar connecting the two islands at low tide is a breathtaking, unforgettable sight."
Anguilla,Maundays Bay,Belmond Cap Juluca,4.9,"$1,200",12/06/2025,None
Japan,Yonaha Maehama Beach (Miyako),Shigira Bayside Suite Allamanda,4.4,$350,10/30/2025,"Seven kilometers of white sand and the calming, deep blue of the Okinawan seapure tranquility."
Mozambique,Benguerra Island,Kisawa Sanctuary,5.0,"$6,000+",11/29/2025,Cutting-edge design blended seamlessly with the wilderness for a deeply restorative retreat.
Cyprus,Fig Tree Bay (Protaras),Capo Bay Hotel,4.3,$190,11/09/2025,"Lovely shallow waters make it perfect for families, with a beautiful little islet to swim to!"
Panama,San Blas Islands,Yandup Island Lodge,4.0,$210,10/07/2025,"True rustic paradise managed by the Kuna peoplesimple, authentic, and spectacularly beautiful."
Dominican Rep.,Canto De La Playa (Saona),Hilton La Romana (Bayahibe),4.5,$380,11/19/2025,"Remote, unspoiled, and blissfully quiet, this is the postcard image of a Caribbean retreat."
Uruguay,Punta del Este,Fasano Punta del Este,4.6,$550,12/04/2025,"Trendy South American beach hub with stunning sunsets and a lively, sophisticated atmosphere."
Tanzania,Nungwi Beach (Zanzibar),Z Hotel Zanzibar,4.4,$290,10/27/2025,Amazing views of the Indian Ocean and a vibrant local culture right outside the door.
Aruba,Eagle Beach,Bucuti & Tara Beach Resort,4.8,$590,03/12/2025,"Wide, soft white sand and the famous Divi Divi trees offer perfect Caribbean shade."
Oman,Six Senses Zighy Bay,Six Senses Zighy Bay,4.8,"$1,100",11/06/2025,Secluded luxury nestled between dramatic mountains and the pristine waters of the Musandam Peninsula.
Vietnam,Phu Quoc,InterContinental Phu Quoc Long Beach,4.6,$230,10/10/2025,None
Chile,Via del Mar,Hotel del Mar (Enjoy Via del Mar),4.3,$160,01/11/2025,None
Maldives,Baa Atoll (UNESCO Reserve),Soneva Fushi,5.0,"$3,500",07/15/2025,"Barefoot luxury at its best, with amazing marine life and a truly sustainable, magical atmosphere.  eco"
Sri Lanka,Mirissa Beach,Weligama Bay Marriott Resort & Spa,4.5,$170,09/17/2025,Perfect spot for watching whales from the shore and enjoying the incredible Sri Lankan tea culture.
Kenya,Diani Beach,Diani Reef Beach Resort & Spa,4.3,$190,12/20/2025,"Wide, white sand and palm trees that sway in the gentle Indian Ocean breezepure East African calm!"
France,Plage de Pampelonne (St. Tropez),Htel Byblos Saint-Tropez,4.7,$980,10/01/2025,"The ultimate French Riviera glamour, mixing chic beach clubs with pure Mediterranean elegance."
Croatia,Hvar Island (Pakleni Islands),Adriana Hvar Spa Hotel,4.6,$280,09/05/2025,None
Barbados,Crane Beach,The Crane Resort,4.5,$350,11/30/2025,The pinkish sand and dramatic coral cliffs make this beach a Caribbean masterpiece!  cliff
Ireland,Keem Bay (Achill Island),The Achill Cliff House Hotel,4.2,$140,10/12/2025,A hidden gem of emerald water surrounded by rugged green mountainswild and absolutely beautiful.
Brazil,Baa do Sancho (Fernando de Noronha),Pousada Z Maria,4.8,$500,11/02/2025,"The best beach in the world, reached by descending a metal ladder through a rock crackworth the climb!"
Tanzania,Mnemba Island (Zanzibar),&Beyond Mnemba Island,5.0,"$2,500+",09/21/2025,None
Fiji,Viti Levu (Coral Coast),Outrigger Fiji Beach Resort,4.4,$250,09/14/2025,"Warm, welcoming Fijian hospitality and a fantastic lagoon for kids and water sports."
Morocco,Essaouira Beach,Sofitel Essaouira Mogador Golf & Spa,4.3,$210,10/10/2025,"Wind-swept beach perfect for kite-surfing, with a cool, artistic town vibe and fresh seafood."
Canada,"Tofino (Long Beach, BC)",Wickaninnish Inn,4.8,$700,11/05/2025,"Rugged Pacific coast beauty, famous for storm watching and cozying up by a seaside fire."
China,Sanya Bay (Hainan Island),Sanya Marriott Hotel Dadonghai Bay,4.4,$180,12/10/2025,Tropical Chinese paradise with warm water and excellent modern resort facilities.
Germany,Sylt (Westerland Beach),Hotel Stadt Hamburg,4.5,$290,09/01/2025,"Charming beach baskets on the North Sea coast and a very chic, European island feel."
Peru,Huanchaco Beach (Trujillo),Hotel Huanchaco International,3.9,$70,10/18/2025,"Traditional reed fishing boats (caballitos de totora) make this a unique, historic surf spot."
Egypt,Naama Bay (Sharm El Sheikh),Four Seasons Resort Sharm El Sheikh,4.8,$550,08/28/2025,"World-class diving in the Red Sea right off the private jetty, with colorful, vibrant reefs."
Seychelles,Anse Source d'Argent (La Digue),Le Repaire - Boutique Hotel & Restaurant,4.6,$320,11/23/2025,"Impossibly beautiful granite boulders frame the shallow, turquoise watersa photographer's dream!"
Dominica,Champagne Reef,Fort Young Hotel,4.1,$160,11/29/2025,"The reef floor bubbles with volcanic activity, making it feel like you are swimming in champagne!"
Argentina,Caril Beach (Buenos Aires),Caril Village Apart Hotel & Spa,4.2,$150,12/15/2025,"Peaceful pine forests meet the expansive sand dunes and the cold, vast Atlantic Ocean.  dunes"
Oman,Al Mughsail Beach (Salalah),Al Baleed Resort Salalah by Anantara,4.6,$450,10/24/2025,The incredible 'Blowholes' shoot ocean water high into the air during the monsoon season.
Cuba,Varadero Beach,Paradisus Varadero Resort & Spa,4.4,$290,09/11/2025,Soft white sand and every shade of blue water you can imaginea truly classic Caribbean resort experience.
Vietnam,Long Beach (Phu Quoc),JW Marriott Phu Quoc Emerald Bay Resort & Spa,4.7,$380,12/03/2025,Stunning resort design with beautiful architecture and perfect sunsets over the long stretch of sand.
Malaysia,Perhentian Islands,Bubu Resort,4.3,$120,10/03/2025,"Simple, serene, and perfect for diving with turtles and small sharks right off the beach."
French Polynesia,Bora Bora (Motu Piti Aau),Four Seasons Resort Bora Bora,4.9,"$1,600",11/20/2025,Overwater bungalow perfection with Mt. Otemanu views and a lagoon that defines blue.
Saint Lucia,Jalousie Beach (Soufriere),"Sugar Beach, a Viceroy Resort",4.8,$990,10/15/2025,"Nestled right between the dramatic Pitons, this resort is pure luxury and natural wonder."
Mauritius,Flic-en-Flac Beach,Sugar Beach  A Sun Resort,4.6,$350,03/11/2025,"Gorgeous sunsets over the vast Indian Ocean and a calm, protected swimming area."
Israel,Hilton Beach (Tel Aviv),Hilton Tel Aviv,4.4,$300,12/08/2025,None
Curacao,Cas Abao Beach,Cas Abao Beach Bungalows,4.2,$150,05/10/2025,"Excellent snorkeling right from the shore on this small, pristine, and well-maintained cove."
Tonga,Eua National Park Beach,Tongan Beach Resort,3.9,$90,11/16/2025,Remote Pacific island feel with incredibly welcoming locals and a focus on nature.
Samoa,Lalomanu Beach,Aga Reef Resort,4.3,$200,10/29/2025,Relaxing open-air fales on a stunning lagoon perfect for kayaking and total tranquility.
Ireland,Coumeenoole Beach (Dingle),Dunquin House B&B,4.5,$110,09/19/2025,Dramatic cliffs and wild Atlantic waves near the scenic Slea Head Drivetrue Irish beauty!
Montenegro,Sveti Stefan,Aman Sveti Stefan,4.9,"$1,500",08/22/2025,Staying on the exclusive fortified island is like stepping back into a medieval luxury fantasy.
Kenya,Watamu Beach,Hemingways Watamu,4.7,$380,11/09/2025,"Famous for its marine park, this quiet beach is great for dolphin spotting and deep-sea fishing."
Peru,Mancora,Kichic Ecolodges,4.1,$180,12/01/2025,"Great northern surfing spot with laid-back vibes and beautiful, eco-friendly lodging."
Estonia,Haapsalu Beach,Hestia Hotel Haapsalu Spa,4.0,$120,08/10/2025,"A shallow, family-friendly beach on the Baltic Sea known for its therapeutic mud."
Yemen,Qalansiya Beach (Socotra),Simple Eco-Lodge/Camping,3.5,$50,11/11/2025,"The unique, alien landscape of Socotra meets the ocean in a stunning, untouched environment."
Honduras,West Bay Beach (Roatn),Grand Roatn Caribbean Resort,4.5,$270,10/04/2025,Easy access to the second-largest barrier reef in the world makes this a diver's dream!
Vanuatu,Champagne Beach,Lonnoc Beach Bungalows,4.2,$80,10/14/2025,"The sand hisses when you walk on it, and the bay is perfectly shaped like a champagne flute."
Brazil,Jericoacoara (Jeri),Hotel Hurricane Jeri,4.6,$290,04/12/2025,"Famous for its windsurfing, massive dunes, and stunning sunset views from the beach."
Tunisia,Sousse Beach,Movenpick Resort & Marine Spa Sousse,4.3,$160,09/25/2025,A bustling Mediterranean beach resort with great pools and easy access to historic sites.
Aruba,Palm Beach,"The Ritz-Carlton, Aruba",4.7,$700,12/06/2025,"Wide beach perfect for watersports, with excellent dining and signature Ritz-Carlton service."
Vietnam,An Bang Beach (Hoi An),The Mansion Hoi An,4.4,$110,10/18/2025,"Charming, relaxed beach town vibe just a short bike ride from the ancient lantern city of Hoi An."
Singapore,Palawan Beach (Sentosa),Capella Singapore,4.8,$850,11/27/2025,Luxurious escape on Sentosa with beautiful grounds and quiet man-made beaches.
Haiti,Labadee,Haiti's Private Resort Area,None,None,11/02/2025,"Gated, pristine cove often visited by cruise ships, offering thrilling zip lines over the water."
Iceland,Slheimasandur (Plane Wreck),Htel Skgafoss,4.0,$190,11/15/2025,"Not for swimming, but the iconic black sand and the DC-3 plane wreck make a surreal trek!"
Portugal,Nazare Beach,Hotel Mar Bravo,4.2,$130,12/07/2025,Home to the world's biggest waves in wintera dramatic sight for surf enthusiasts!
Sweden,Tylsand Beach (Halmstad),Hotel Tylsand,4.5,$220,08/05/2025,"A long, beautiful stretch of white sand on the west coast, known for its fun summer beach clubs."
Finland,Yyteri Beach (Pori),Yyteri Hotel & Spa,4.1,$140,08/18/2025,"One of the largest sand dune areas in the Nordics, offering a great Baltic Sea experience."
Costa Rica,Playa Manuel Antonio,Tulemar Resort,4.8,$550,12/11/2025,"White sand, lush jungle, and friendly monkeys that greet you right outside your doorpure Pura Vida!"
Bulgaria,Sozopol Beach,Hotel Selena,4.1,$90,08/15/2025,"Charming old town vibe next to the Black Sea, offering great value and unique Eastern European culture."
Taiwan,Kenting National Park Beaches,Chateau Beach Resort Kenting,4.3,$170,10/25/2025,"Taiwan's tropical south offers warm water, great diving, and vibrant night markets nearby."
Venezuela,Los Roques (Cayo de Agua),Posada Caracol,4.5,$280,12/02/2025,"The most remote, dazzling white sandbars in the Caribbean, reached only by a short boat trip."
Gibraltar (UK),Catalan Bay,Catalan Bay Suite,4.3,$180,10/10/2025,"A small, colorful fishing village nestled at the base of the Rock of Gibraltar with a Spanish feel."
Nigeria,Tarkwa Bay Beach (Lagos),Eko Hotel & Suites,3.9,$140,12/05/2025,"A boat trip away from the bustle of Lagos, offering a lively local beach experience and surfing."
Ghana,Busua Beach,Busua Beach Resort,4.0,$110,10/20/2025,"Great place to relax on the Atlantic coast, learn to surf, and enjoy the West African hospitality."
Croatia,Myrtos Beach (Kefalonia),Emelisse Nature Resort,4.7,$380,09/15/2025,The stunning white pebbles contrast perfectly with the deep sapphire-blue Ionian Sea.
Greece,Mykonos (Psarou Beach),Nammos Village,4.8,"$1,200",08/25/2025,"The most exclusive spot in the Cyclades, combining glamorous beach clubs with high-end dining."
Panama,Bocas del Toro (Red Frog Beach),Red Frog Beach Island Resort,4.1,$240,11/06/2025,"Isolated tropical islands with rain forest trails and tiny, brightly colored red frogs!"
Norway,Kvalvika Beach (Lofoten),Tind Rorbuer (Fisherman's Cabin),4.6,$250,07/28/2025,"A stunning beach surrounded by towering Arctic mountains, accessible only by a challenging hike."
South Korea,Haeundae Beach (Busan),Paradise Hotel Busan,4.5,$220,10/29/2025,"A massive, bustling urban beach framed by towering skyscrapers and vibrant city life."
Uruguay,Cabo Polonio,La Posada de Cabo Polonio,3.8,$80,12/15/2025,"No electricity or roads, just vast dunes, a lighthouse, and sea lionsa truly rustic escape."
Russia,Vityaz Bay (Primorsky Krai),Marine Resort Gornostay,3.7,$70,08/01/2025,"Remote Russian Far East coast with clear water, surrounded by mountains and unique nature."
Jordan,Aqaba South Beach,Mvenpick Resort & Residences Aqaba,4.4,$200,11/22/2025,None
Ecuador,Puerto Lopez (Isla de la Plata),Hostera del Puerto,4.0,$95,02/10/2025,"The ""Poor Man's Galapagos"" for whale watching and viewing blue-footed boobies near the coast."
Northern Ireland (UK),Giant's Causeway,The Causeway Hotel,4.3,$160,09/01/2025,"Not a sand beach, but the 40,000 hexagonal basalt columns make it a geological coastal marvel!"
India,Varkala Beach (Kerala),The Gateway Varkala - IHCL SeleQtions,4.2,$130,11/19/2025,"Dramatic red cliffs overlook the Arabian Sea, perfect for yoga and sunset views."
Cuba,Cayo Santa Mara,Royalton Cayo Santa Maria,4.4,$320,12/09/2025,"Gorgeous, remote keys with calm water and beautiful all-inclusive resorts built over the ocean."
Peru,Punta Sal,Decameron Punta Sal,4.1,$180,10/26/2025,"Northern Peru's sunniest beach, known for dolphin and humpback whale sightings in the Pacific."
Kenya,Malindi Beach,Diamonds Dream of Africa,4.5,$270,11/30/2025,"Italian-influenced coastal town with a rich history and clear, warm waters for swimming."
Belgium,Ostend Beach,Hotel Princess,4.0,$140,08/12/2025,"A long, bustling city beach on the North Sea with sandcastles and classic Belgian fries!"
Saint Martin (Fr/Neth),Maho Beach,Sonesta Ocean Point Resort,4.3,$450,12/14/2025,"The famous beach where jets land right over your headan unparalleled, noisy photo opportunity!"
Cambodia,Koh Rong,Secret Inn,4.8,$590,12/03/2025,Loved the beach access and friendly staff  ! Rooms were comfy and super clean .
Thailand,Koh Tao,Grand Bungalow,4.8,"$1,100",11/06/2025,"Fair price, short walk to the shore . Bed comfortable; bathroom average  ."
Philippines,Boracay,Mountain Bungalow,4.6,$230,10/10/2025,"Location is nice, yet cleanliness could improve . Mosquitos at night  and slow checkin ."
Indonesia,Gili Trawangan,Sunset Suites,4.3,$160,11/01/2025,Family had a blast; pool and kids area were spot on  . Steps from the sand .
Indonesia,Seminyak,Turtle Suites,5.0,"$3,500",12/10/2025,Family had a blast; pool and kids area were spot on  . Steps from the sand .
Singapore,Sentosa,Grand Bungalow,4.5,$170,11/25/2025,"Solid midrange choice nothing fancy, but clean and convenient  ."
Thailand,Koh Phangan,Golden Villa,4.3,$190,10/18/2025,Overpriced for what you get . Shower pressure low and WiFi spotty  .
Timor-Leste (East Timor),Dili,Ocean Inn,4.7,$980,09/02/2025,Family had a blast; pool and kids area were spot on  . Steps from the sand .
Laos,Don Det,Golden Hostel,4.6,$280,08/15/2025,"Great beach, but room upkeep needs work . AC struggled and some noise issues  ."
Singapore,HarbourFront,Paradise Hostel,4.5,$350,11/04/2025,None
Timor-Leste (East Timor),Atauro Island,Royal Bungalow,4.2,$140,10/01/2025,Family had a blast; pool and kids area were spot on  . Steps from the sand .
Indonesia,Uluwatu,Mountain Hotel,4.8,$500,12/05/2025,Beautiful vibe with island charm . Housekeeping was on point and service was warm  .
Cambodia,Kampot,Turtle Inn,5.0,"$2,500+",11/28/2025,Amazing locationsunsets were unreal . Great value and tasty breakfast  .
Laos,Savannakhet,Sunset Hotel,4.4,$250,10/09/2025,"Decent stay near the beach . Room was fine, could use a refresh . Good for quick trips ."
Brunei,Jerudong,Turtle Inn,4.3,$210,11/14/2025,Amazing locationsunsets were unreal . Great value and tasty breakfast  .
Brunei,Muara,Ocean Inn,4.8,$700,12/07/2025,Loved the beach access and friendly staff  ! Rooms were comfy and super clean .
Cambodia,Sihanoukville,Hidden Inn,4.4,$180,10/23/2025,Loved the beach access and friendly staff  ! Rooms were comfy and super clean .
Thailand,Pattaya,Blue Villa,4.5,$290,09/05/2025,"Perfect getaway: quiet nights, clear water, and fast WiFi  . Will come back!"
Laos,Si Phan Don,Ocean Bungalow,3.9,$70,11/01/2025,"Perfect getaway: quiet nights, clear water, and fast WiFi  . Will come back!"
Indonesia,Kuta,Paradise Villa,4.8,$550,10/16/2025,Beautiful vibe with island charm . Housekeeping was on point and service was warm  .
Indonesia,Canggu,Golden Hotel,4.6,$320,12/02/2025,None
Timor-Leste (East Timor),Atauro Island,Turtle Inn,4.1,$160,11/13/2025,"Decent stay near the beach . Room was fine, could use a refresh . Good for quick trips ."
Indonesia,Lombok,Golden Hotel,4.2,$150,12/08/2025,"Perfect getaway: quiet nights, clear water, and fast WiFi  . Will come back!"
Brunei,Bandar Seri Begawan,Ocean Resort,4.6,$450,10/25/2025,Loved the beach access and friendly staff  ! Rooms were comfy and super clean .
Vietnam,Nha Trang,Blue Resort,4.4,$290,11/07/2025,"Could be better: dated interiors, occasional maintenance problems   ."
Myanmar (Burma),Ngwe Saung,Golden Villa,4.7,$380,10/21/2025,"Great beach, but room upkeep needs work . AC struggled and some noise issues  ."
Singapore,HarbourFront,Sunset Hotel,4.3,$120,09/30/2025,Beautiful vibe with island charm . Housekeeping was on point and service was warm  .
Malaysia,Tioman,Cozy Hostel,4.0,$210,11/17/2025,Nice location but you can hear some noise at night . Breakfast okay and staff helpful  .
Vietnam,Hoi An,Blue Lodge,4.6,$350,11/03/2025,Loved the beach access and friendly staff  ! Rooms were comfy and super clean .
Indonesia,Uluwatu,Palm Hotel,4.4,$300,12/08/2025,Loved the beach access and friendly staff  ! Rooms were comfy and super clean .
Malaysia,Kota Kinabalu,Turtle Inn,4.2,$150,10/05/2025,"Great beach, but room upkeep needs work . AC struggled and some noise issues  ."
Myanmar (Burma),Chaung Tha,Hidden Lodge,3.9,$90,11/16/2025,"Solid midrange choice nothing fancy, but clean and convenient  ."
Brunei,Muara,Secret Inn,4.3,$200,10/29/2025,Nice location but you can hear some noise at night . Breakfast okay and staff helpful  .
Philippines,Panglao,Cozy Resort,4.5,$110,09/19/2025,"Perfect getaway: quiet nights, clear water, and fast WiFi  . Will come back!"
Vietnam,Phu Quoc,Turtle Inn,4.9,"$1,500",08/22/2025,Amazing locationsunsets were unreal . Great value and tasty breakfast  .
Indonesia,Lombok,Turtle Inn,4.7,$380,11/09/2025,Amazing locationsunsets were unreal . Great value and tasty breakfast  .
Indonesia,Canggu,Royal Hotel,4.2,$80,10/14/2025,"Perfect getaway: quiet nights, clear water, and fast WiFi  . Will come back!"
Thailand,Koh Tao,Ocean Hostel,4.6,$290,12/04/2025,"Perfect getaway: quiet nights, clear water, and fast WiFi  . Will come back!"
Cambodia,Kep,Grand Suites,3.5,$50,11/11/2025,"Great beach, but room upkeep needs work . AC struggled and some noise issues  ."
Singapore,HarbourFront,Hidden Villa,4.5,$270,10/04/2025,Amazing locationsunsets were unreal . Great value and tasty breakfast  .
Laos,Savannakhet,Royal Hostel,4.3,$160,09/25/2025,Family had a blast; pool and kids area were spot on  . Steps from the sand .
Laos,Savannakhet,Royal Hostel,4.7,$700,12/06/2025,Overpriced for what you get . Shower pressure low and WiFi spotty  .
Brunei,Serasa,Royal Hostel,4.4,$110,10/18/2025,"Solid midrange choice nothing fancy, but clean and convenient  ."
